{
  "version": "0.1.0",
  "H": [
    {
      "id": "h-1",
      "title": "API change requires semver minor",
      "body": "Adding a non-breaking endpoint should bump minor.",
      "status": "open",
      "evidence_ids": ["e-1"],
      "created_at": "2025-09-26T08:00:00Z"
    }
  ],
  "E": [
    {
      "id": "e-1",
      "kind": "policy",
      "uri": "file://policies/semver.md",
      "hash": "aaaaaaaaaaaaaaaaaaaaaaaaaaaaaaaaaaaaaaaaaaaaaaaaaaaaaaaaaaaaaaaa",
      "provenance": "repo",
      "created_at": "2025-09-26T07:50:00Z"
    }
  ],
  "K": [
    {
      "id": "k-semver-1",
      "source": "semver",
      "rule": "public API addition â†’ minor >= +1",
      "severity": "high",
      "tags": ["api","versioning"]
    }
  ],
  "A": [],
  "J": {
    "version": "0.1.0",
    "entries": []
  },
  "Sigma": {
    "repo": "git@github.com:org/proof-engine.git",
    "branch": "feature/pec-spec_pack.code-v0",
    "commit": "bbbbbbbbbbbbbbbbbbbbbbbbbbbbbbbbbbbbbbbbbbbbbbbbbbbbbbbbbbbbbbbb",
    "tooling": { "python": "3.11.9", "llm_model": "gpt-4.1" }
  }
}