{
  "version": "0.1.0",
  "H": [
    {
      "id": "h-task-001",
      "title": "Rename symbol task",
      "body": "Need to rename function 'old_name' to 'new_name' in utils.py",
      "status": "open",
      "evidence_ids": ["e-task-001"],
      "created_at": "2025-09-27T11:45:00Z"
    },
    {
      "id": "h-task-002", 
      "title": "Fix off-by-one bug",
      "body": "Fix off-by-one error in range() loop in algorithms.py",
      "status": "open",
      "evidence_ids": ["e-task-002"],
      "created_at": "2025-09-27T11:45:00Z"
    }
  ],
  "E": [
    {
      "id": "e-task-001",
      "kind": "code",
      "uri": "file://utils.py",
      "hash": "aaaaaaaaaaaaaaaaaaaaaaaaaaaaaaaaaaaaaaaaaaaaaaaaaaaaaaaaaaaaaaaa",
      "created_at": "2025-09-27T11:45:00Z"
    },
    {
      "id": "e-task-002",
      "kind": "code", 
      "uri": "file://algorithms.py",
      "hash": "bbbbbbbbbbbbbbbbbbbbbbbbbbbbbbbbbbbbbbbbbbbbbbbbbbbbbbbbbbbbbbbb",
      "created_at": "2025-09-27T11:45:00Z"
    }
  ],
  "K": [
    {
      "id": "k-semver-1",
      "source": "semver",
      "rule": "public API change â†’ minor >= +1",
      "severity": "high",
      "tags": ["api", "versioning"]
    },
    {
      "id": "k-perf-1",
      "source": "internal", 
      "rule": "performance regression < 5%",
      "severity": "medium",
      "tags": ["performance"]
    }
  ],
  "A": [],
  "J": {
    "version": "0.1.0",
    "entries": []
  },
  "Sigma": {
    "repo": "git@github.com:org/proof-engine.git",
    "branch": "feature/orchestrator-skeleton",
    "commit": "cccccccccccccccccccccccccccccccccccccccccccccccccccccccccccccccc",
    "tooling": {
      "python": "3.11.9",
      "llm_model": "gpt-4.1"
    }
  }
}
